{
  "$schema": "https://json-schema.org/draft/2020-12/schema",
  "$id": "https://mknoon.local/schemas/feature.schema.json",
  "title": "Mknoon feature contract",
  "type": "object",
  "additionalProperties": false,
  "required": [
    "schemaVersion",
    "id",
    "title",
    "prd",
    "prdVersion",
    "intentStatus",
    "behaviorsFile",
    "coverageFile",
    "testResultsFile",
    "implementationReviewsFile"
  ],
  "properties": {
    "$schema": { "type": "string" },
    "schemaVersion": { "const": 1 },
    "id": { "type": "string", "pattern": "^[a-z][a-z0-9-]*$" },
    "title": { "type": "string", "minLength": 1 },
    "description": { "type": "string" },
    "prd": { "type": "string", "minLength": 1 },
    "prdVersion": { "type": "string", "minLength": 1 },
    "prdDate": { "type": "string", "format": "date" },
    "intentStatus": { "enum": ["draft", "proposed", "active", "deprecated"] },
    "behaviorsFile": { "type": "string" },
    "coverageFile": { "type": "string" },
    "testResultsFile": { "type": "string" },
    "implementationReviewsFile": { "type": "string" },
    "openQuestions": {
      "type": "array",
      "items": { "type": "string", "pattern": "^OQ-[0-9]{2}$" },
      "uniqueItems": true
    }
  }
}
